<?xml version="1.0" ?>
<!ELEMENT Modules (Driver+)>
<!ELEMENT Driver (Description?, DistinguishName?, Port+, ParamList?)>
<!ELEMENT Description (#PCDATA)>
<!ELEMENT DistinguishName (#PCDATA)>
<!ATTLIST Driver name NMTOKEN #REQUIRED>
<!ELEMENT Port (PortNameList, PortSpeed, PortBits)>
<!ATTLIST Port type ( serial | usb ) #REQUIRED
               auto ( yes | no | def | only ) #REQUIRED>
<!ELEMENT PortNameList (PortName+)>
<!ELEMENT PortName EMPTY>
<!ATTLIST PortName value CDATA #REQUIRED>
<!ELEMENT PortSpeed EMPTY>
<!ATTLIST PortSpeed value (600 | 1200 | 2400 | un) #REQUIRED>
<!ELEMENT PortBits EMPTY>
<!ATTLIST PortBits value (7 | 8 | un) #REQUIRED>
<!ELEMENT ParamList (ParamNumber | ParamString | ParamEnum )+>
<!ELEMENT ParamNumber (ParamMinimum?, ParamMaximum?,ParamNumberDefault?)>
<!ATTLIST ParamNumber force (yes | no) #REQUIRED
                      name NMTOKEN #REQUIRED>
<!ELEMENT ParamNumberDefault EMPTY>
<!ATTLIST ParamNumberDefault value NMTOKEN #REQUIRED>
<!ELEMENT ParamMinimum EMPTY>
<!ATTLIST ParamMinimum value NMTOKEN #REQUIRED>
<!ELEMENT ParamMaximum EMPTY>
<!ATTLIST ParamMaximum value NMTOKEN #REQUIRED>
<!ELEMENT ParamString (ParamStringDefault?) >
<!ATTLIST ParamString force (yes | no) #REQUIRED
                      name NMTOKEN #REQUIRED
                      variable (yes | no) #REQUIRED>
<!ELEMENT ParamStringDefault (#PCDATA)>

<!ELEMENT ParamEnum (ParamEnumDefault?, ParamEnumValueList)>
<!ATTLIST ParamEnum force (yes | no) #REQUIRED
                    name NMTOKEN #REQUIRED>
<!ELEMENT ParamEnumDefault EMPTY>
<!ATTLIST ParamEnumDefault value NMTOKEN #REQUIRED>
<!ELEMENT ParamEnumValueList (ParamEnumValue+)>
<!ELEMENT ParamEnumValue (#PCDATA)>
<!ATTLIST ParamEnumValue value NMTOKEN #REQUIRED>
